{
  "$schema": "http://json-schema.org/draft-07/schema#",
  "$id": "https://raw.githubusercontent.com/glyph-md/plugins/main/plugin.schema.json",
  "title": "Glyph plugin registration",
  "description": "One plugin's registration: plugins/<id>/plugin.json. The folder name must equal the id, and a README.md (the catalog page) must sit next to it. index.json is generated from these files.",
  "type": "object",
  "required": ["id", "name", "version", "apiVersion", "category", "packageUrl", "sha256"],
  "additionalProperties": false,
  "properties": {
    "$schema": {
      "type": "string"
    },
    "id": {
      "type": "string",
      "pattern": "^(?![Gg][Ll][Yy][Pp][Hh]\\.[Cc][Oo][Rr][Ee]\\.)[A-Za-z0-9][A-Za-z0-9._-]*$",
      "description": "Unique reverse-DNS id; also the folder name here and the install folder name."
    },
    "name": {
      "type": "string",
      "minLength": 1
    },
    "description": {
      "type": "string"
    },
    "version": {
      "type": "string",
      "pattern": "^\\d+\\.\\d+\\.\\d+$",
      "description": "Plugin semver; must increase when packageUrl changes."
    },
    "apiVersion": {
      "type": "string",
      "pattern": "^\\^?\\d+\\.\\d+\\.\\d+$",
      "description": "Glyph plugin-API version the plugin was built against. Unstable until 1.0: while the API major is 0 the host loads anything inside its compatibility window, from the floor (0.16.0) up to the running app version, and a caret grants nothing; caret ranges apply from 1.0.0."
    },
    "category": {
      "type": "string",
      "enum": ["themes", "markdown", "exporters", "tools", "integrations", "language", "ai"],
      "description": "Which marketplace section the plugin belongs to."
    },
    "keywords": {
      "type": "array",
      "items": {
        "type": "string"
      },
      "description": "Extra search terms shown nowhere but matched by the marketplace search."
    },
    "official": {
      "type": "boolean",
      "description": "Maintained in this repo (source lives in the plugin's folder and packages are released from here). Community plugins omit it."
    },
    "permissions": {
      "type": "array",
      "items": {
        "type": "string"
      },
      "description": "Capabilities the plugin declares; shown to users in the install consent prompt."
    },
    "sandbox": {
      "type": "boolean",
      "description": "Run the plugin in an isolated worker (no DOM, network fenced to its network: permissions). Defaults to true when absent; only an explicit false opts into full trust, which users must approve through a separate full-access warning."
    },
    "packageUrl": {
      "type": "string",
      "pattern": "^https://",
      "description": "HTTPS URL of the plugin's release zip (manifest.json plus the manifest-declared files), pinned to a tag."
    },
    "sha256": {
      "type": "string",
      "pattern": "^[A-Fa-f0-9]{64}$",
      "description": "SHA-256 hex digest of the packageUrl zip; Glyph verifies the download before installing."
    }
  }
}
