{
  "$schema": "../../plugin.schema.json",
  "id": "com.glyph.dictionary-fa",
  "name": "Persian Dictionary",
  "description": "Persian (Farsi) spell-check dictionary, based on the Lilak project.",
  "version": "1.0.0",
  "apiVersion": "0.16.0",
  "category": "language",
  "keywords": ["spellcheck", "dictionary", "persian", "farsi"],
  "official": true,
  "packageUrl": "https://github.com/glyph-md/plugins/releases/download/com.glyph.dictionary-fa-v1.0.0/com.glyph.dictionary-fa.zip",
  "sha256": "1dd766472ed6a253cc1c1937f8d4fa325558f4d4beb6c807d2f45ca0d3b26658"
}
